{
  "schema": "gtosd.preflop_blueprint_game.v1",
  "id": "MONKER-HU50-SYMMETRICAL-001",
  "monetary_contract_revision": 2,
  "ante_accounting": "dead_initial_pot_contribution",
  "preflop_target_basis": "live_commitment_excluding_dead_ante",
  "player_count": 2,
  "positions": [
    "CO",
    "BTN"
  ],
  "effective_stack_units": 500000,
  "ante_units": 10000,
  "button_blind_units": 10000,
  "open_target_units": [
    50000
  ],
  "response_target_units": [],
  "allow_configured_incomplete_raise": true,
  "postflop_sizes_basis_points": [
    10000
  ],
  "postflop_minimum_bet_units": 10000,
  "include_all_in": true,
  "raise_termination": "natural_stack",
  "rake_mode": "disabled"
}