{
  "schema": "gtosd.preflop_blueprint_game.v1",
  "id": "PREFLOP-BLUEPRINT-HU10-FULL-001",
  "monetary_contract_revision": 2,
  "ante_accounting": "dead_initial_pot_contribution",
  "preflop_target_basis": "live_commitment_excluding_dead_ante",
  "player_count": 2,
  "positions": ["CO", "BTN"],
  "effective_stack_units": 100000,
  "ante_units": 10000,
  "button_blind_units": 10000,
  "open_target_units": [50000],
  "response_target_units": [80000],
  "allow_configured_incomplete_raise": true,
  "postflop_sizes_basis_points": [3300, 6600, 12000],
  "postflop_minimum_bet_units": 10000,
  "include_all_in": true,
  "raise_termination": "natural_stack",
  "rake_mode": "disabled"
}
